{
  "additionalProperties": false,
  "properties": {
    "execution_id": {
      "title": "Execution Id",
      "type": "string"
    },
    "uri": {
      "title": "Uri",
      "type": "string"
    },
    "document_name": {
      "title": "Document Name",
      "type": "string"
    },
    "document_hash": {
      "title": "Document Hash",
      "type": "string"
    },
    "api_version": {
      "title": "Api Version",
      "type": "string"
    },
    "kind": {
      "title": "Kind",
      "type": "string"
    },
    "project_id": {
      "title": "Project Id",
      "type": "string"
    },
    "base_revision": {
      "title": "Base Revision",
      "type": "string"
    },
    "source_format": {
      "enum": [
        "twin",
        "yaml",
        "json"
      ],
      "title": "Source Format",
      "type": "string"
    },
    "source_text": {
      "title": "Source Text",
      "type": "string"
    },
    "dry_run": {
      "default": true,
      "title": "Dry Run",
      "type": "boolean"
    },
    "status": {
      "default": "compiled",
      "enum": [
        "validated",
        "compiled",
        "executed",
        "partially_executed",
        "rejected"
      ],
      "title": "Status",
      "type": "string"
    },
    "command_types": {
      "items": {
        "type": "string"
      },
      "title": "Command Types",
      "type": "array"
    },
    "event_ids": {
      "items": {
        "type": "string"
      },
      "title": "Event Ids",
      "type": "array"
    },
    "warnings": {
      "items": {
        "type": "string"
      },
      "title": "Warnings",
      "type": "array"
    },
    "errors": {
      "items": {
        "type": "string"
      },
      "title": "Errors",
      "type": "array"
    },
    "created_by": {
      "title": "Created By",
      "type": "string"
    },
    "created_at": {
      "format": "date-time",
      "title": "Created At",
      "type": "string"
    }
  },
  "required": [
    "uri",
    "document_name",
    "document_hash",
    "api_version",
    "kind",
    "project_id",
    "base_revision",
    "source_format",
    "source_text",
    "created_by"
  ],
  "title": "DslExecutionRecord",
  "type": "object",
  "$schema": "https://json-schema.org/draft/2020-12/schema",
  "$id": "https://twinstudio.local/schemas/dsl-execution.schema.json"
}
